URL,TITLE,LOCATION,PRICE PER MONTH,AREA IN m²,NUMBER OF ROOMS,INTERIOR,DESCRIPTION,OFFERED SINCE,AVAILABILITY,SPECIFICATION,UPKEEP STATUS,VOLUME,TYPE,CONSTRUCTION TYPE,CONSTRUCTION YEAR,LOCATION TYPE,NUMBER OF BEDROOMS,NUMBER OF BATHROOMS,NUMBER OF FLOORS,DETAILS OF BALCONY,DETAILS OF GARDEN,DETAILS OF STORAGE,DESCRIPTION OF STORAGE,GARAGE,CONTACT DETAILS,TIMESTAMP
https://www.pararius.com/apartment-for-rent/amsterdam/da0507bf/sijlhoff,Apartment Sijlhoff,1082 EP (Buitenveldert-West),2500,120,6,Upholstered,"Beautifully spacious, light and recently renovated apartment measuring approximately 120 sq. m. with 4 large bedrooms, a south-facing balcony, uninterrupted views over lush greenery, lots of sunlight and amazing privacy at the front and rear. This spacious home is ideal for families, home workers or expats in need of a spacious guest room! The home occupies the top two floors of a well-maintained apartment complex – no upstairs neighbours! The house is offered upholstered, if desired it's also possible to rent the house furnished at an additional cost.",2 months,consultation,Specifics are not available,Good,400,Apartment,Existing building,1961,Location type is not available,4,1,2,Present,Not present,Present,Box,Yes,https://www.pararius.com/contact/da0507bf/amsterdam/ramon-mossel-makelaardij-amsterdam-2/request-details,22-08-2022
https://www.pararius.com/apartment-for-rent/amsterdam/cedda470/keizersgracht,Apartment Keizersgracht 480 B,1017 EG (Grachtengordel-Zuid),1995,79,2,Furnished,"On one of the most famous and beautiful canals in the world we offer this fully furnished 2-room apartment. The Keizersgracht is one of the three main canals of Amsterdam and is very centrally located. Within a few minutes you are at the always lively Leidseplein square, but also the main shoppingstreets like Kalverstraat, Leidsestraat and Nieuwendijk are just around the corner.",2 months,Not available to book,Specifics are not available,Good,198,Apartment,Existing building,1905,Location type is not available,1,Number of bathrooms is not available,1,Not present,Present,Details of storage is not available,Details of description of the storage is not available,No,https://www.pararius.com/contact/cedda470/amsterdam/easymakelaars/request-details,22-08-2022
https://www.pararius.com/apartment-for-rent/amsterdam/a312e1e1/argonautenstraat,Apartment Argonautenstraat,1076 KV (Stadionbuurt),3100,120,4,Upholstered,"Recently renovated and luxurious family apartment with 3 bedrooms and a big sunny terrace. This fully renovated and bright apartment located on the top floors of the building (2nd, 3rd and attic). It has gorgeous wooden floors throughout, and a modern high quality kitchen. This open plan kitchen has all necessary appliances including: double door refrigerator, microwave/oven combi, stainless steel hood, 5-burner gas hob, and a dishwasher. Current condition is semi-furnished although furnished is also possible at extra charge. Parking permit is immediately available.   ",2 months,Not available to book,Specifics are not available,Upkeep is not available,Volume is not available,Apartment,Existing building,Constructed year is not available,Location type is not available,3,1,Number of floors is not available,Present,Not present,Not present,Details of description of the storage is not available,Yes,https://www.pararius.com/contact/a312e1e1/amsterdam/zen-home-rentals/request-details,22-08-2022
https://www.pararius.com/apartment-for-rent/amsterdam/efd1f4f8/hemonystraat,Apartment Hemonystraat 1 2,1074 BK (Oude Pijp),3000,110,4,Upholstered,"Stunning canal apartment situated at a top location between De Pijp and the famous Canal belt. Walking distance to everything, supermarket across the street. ",2 months,Not available to book,Specifics are not available,Good,330,Apartment,Existing building,1918,Location type is not available,3,Number of bathrooms is not available,1,Details of balcony is not available,Not present,Not present,Details of description of the storage is not available,Yes,https://www.pararius.com/contact/efd1f4f8/amsterdam/grand-relocation/request-details,22-08-2022
https://www.pararius.com/apartment-for-rent/amsterdam/5341e1e4/emmy-andriessestraat,Apartment Emmy Andriessestraat,1087 NE (IJburg Zuid),1784,114,3,Interior is not available,Charming apartment for rent in Amsterdam with 2 bedrooms in the IJburg Zuid district.,2 months,Not available to book,Specifics are not available,Good,285,Apartment,Existing building,2010,Location type is not available,2,1,1,Details of balcony is not available,Not present,Details of storage is not available,Parkeerplaats,Yes,https://www.pararius.com/contact/5341e1e4/amsterdam/van-t-hof-rijnland-vastgoedmanagement-den-haag/request-details,22-08-2022
https://www.pararius.com/apartment-for-rent/amsterdam/92cde2d7/prinsengracht,Apartment Prinsengracht 625 2,1016 HV (Grachtengordel-West),3250,120,4,Upholstered,NEW FOR RENT!,2 months,Not available to book,Specifics are not available,Excellent,325,Apartment,Existing building,1005,By the water,2,1,3,Not present,Details of garden is not available,Details of storage is not available,Details of description of the storage is not available,Yes,https://www.pararius.com/contact/92cde2d7/amsterdam/27-huis-makelaars/request-details,22-08-2022
https://www.pararius.com/apartment-for-rent/amsterdam/65099420/willemsparkweg,Apartment Willemsparkweg,1071 GN (Museumkwartier),5400,185,6,Upholstered,This apartment is not suitable for sharing or students!,2 months,Not available to book,Specifics are not available,Upkeep is not available,Volume is not available,Apartment,Existing building,Constructed year is not available,Location type is not available,5,4,Number of floors is not available,Not present,Not present,Details of storage is not available,Details of description of the storage is not available,No,https://www.pararius.com/contact/65099420/amsterdam/aham-vastgoed/request-details,22-08-2022
https://www.pararius.com/apartment-for-rent/amsterdam/c4ce061d/gerrit-van-der-veenstraat,Apartment Gerrit van der Veenstraat,1077 EH (Apollobuurt),4400,127,5,Upholstered,"In Amsterdam Old South situated nice modern fully renovated 3 bedroom and 2 bathroom apartment. Apartment has underfloor heating, Airconditioning, double glass, TV’s in every room and kitchen that are already connected to a running network. Internet up and running. Situated on the first floor and located all on one level. Situated on the corner of a nice shopping street Beethovenstraat with a Starbucks, super markets, lunch rooms, cloth shops. Line 5 tram to WTC, Amstelveen International School and Central Station. Walking distance to WTC and Wilhelminapark. Situated on 1st floor, private entrance. ",2 months,Not available to book,Specifics are not available,Good,360,Apartment,Existing building,1930,Location type is not available,3,2,1,Details of balcony is not available,Not present,Not present,Details of description of the storage is not available,Yes,https://www.pararius.com/contact/c4ce061d/amsterdam/tvn-real-estate/request-details,22-08-2022
https://www.pararius.com/apartment-for-rent/amsterdam/5ff421bd/kerkstraat,Apartment Kerkstraat 132 A,1017 GP (Grachtengordel-Zuid),3850,129,4,Interior is not available,Elegant living in a high-end fully renovated apartment in the center of Amsterdam.,2 months,Not available to book,Specifics are not available,Good,348,Apartment,Existing building,Before 1906,Location type is not available,2,2,2,Not present,Not present,Details of storage is not available,Details of description of the storage is not available,No,https://www.pararius.com/contact/5ff421bd/amsterdam/broersma-makelaardij/request-details,22-08-2022
https://www.pararius.com/apartment-for-rent/amsterdam/b07031e5/waalstraat,Apartment Waalstraat,1079 DR (Scheldebuurt),2150,75,3,Furnished,"Beautifully renovated ground floor apartment in the popular Rivierenbuurt with garden and terrace. The house has recently been completely renovated with the finest materials. From the hall you enter the spacious and bright living room with open kitchen. The modern kitchen is fully equipped with all conceivable appliances, such as a dishwasher, combi-microwave, a combination tap (quooker) with boiling water function. The master bedroom is at the rear of the house. This is separated from the living room with beautiful sliding glass doors. The second bedroom is also located at the rear and the bathroom has a bath with a shower. The house is equipped with underfloor heating. There is a beautifully landscaped terrace with lots of sun. There is also a shed at the back of the garden. The Waalstraat is a quiet street in the beautiful Rivierenbuurt, with all the shops, restaurants and conviviality. In addition, it is 5 minutes by bike from the Pijp. With Rai station, the tram and metro station N / Z-line around the corner, there is a lot of public transport and also for car users, this is the perfect place, 2 minutes from Ring A10 and more than enough parking space in front of the door (no waiting list for a permit ).",2 months,Not available to book,Specifics are not available,Upkeep is not available,Volume is not available,Apartment,Existing building,Constructed year is not available,Location type is not available,2,1,Number of floors is not available,Not present,Present (25 m²),Not present,Details of description of the storage is not available,No,https://www.pararius.com/contact/b07031e5/amsterdam/friedmann-housing/request-details,22-08-2022
https://www.pararius.com/apartment-for-rent/amsterdam/b569ffe7/minervalaan,Apartment Minervalaan,1077 NL (Apollobuurt),4950,164,6,Upholstered,Located in the high end Oud-Zuid area of Amsterdam we offer this amazing unfurnished 4-bedroom property with garden!,2 months,Not available to book,Specifics are not available,Upkeep is not available,Volume is not available,Apartment,Existing building,Constructed year is not available,Location type is not available,4,Number of bathrooms is not available,Number of floors is not available,Present,Present,Present,Details of description of the storage is not available,Yes,https://www.pararius.com/contact/b569ffe7/amsterdam/park-real-estate/request-details,22-08-2022
https://www.pararius.com/apartment-for-rent/amsterdam/35f18df0/leeuwenwerf,Apartment Leeuwenwerf,1018 KA (Oostelijke Eilanden/Kadijken),2450,104,4,Interior is not available,Charming apartment with garden for rent in Amsterdam with 3 bedrooms in the Oostelijke Eilanden/Kadijken district.,2 months,Not available to book,Specifics are not available,Excellent,240,Apartment,Existing building,1975,Location type is not available,3,1,2,Present,"Present (45 m², located on the north-west)",Details of storage is not available,Details of description of the storage is not available,No,https://www.pararius.com/contact/35f18df0/amsterdam/huisportaal-nl/request-details,22-08-2022
https://www.pararius.com/house-for-rent/amsterdam/4c1a8402/moestuinlaan,House Moestuinlaan,1036 KD (Tuindorp Oostzaan),4500,200,10,Upholstered or furnished,Furnished or upholstered house with garden for rent in Amsterdam with 5 bedrooms in the Tuindorp Oostzaan district.,2 months,consultation,Specifics are not available,Excellent,673,House,Existing building,2016,Location type is not available,5,3,2,Not present,Present (100 m²),Details of storage is not available,Details of description of the storage is not available,No,https://www.pararius.com/contact/4c1a8402/amsterdam/von-poll-real-estate-centrum/request-details,22-08-2022
https://www.pararius.com/apartment-for-rent/amsterdam/ea80b21c/herengracht,Apartment Herengracht,1015 BH (Grachtengordel-West),2350,75,2,Furnished,Beautiful apartment in a 17th century canalhouse wit a great view over the canal.   ,2 months,Not available to book,Specifics are not available,Upkeep is not available,Volume is not available,Apartment,Existing building,Constructed year is not available,Location type is not available,1,1,Number of floors is not available,Not present,Not present,Not present,Details of description of the storage is not available,No,https://www.pararius.com/contact/ea80b21c/amsterdam/tekke-housing/request-details,22-08-2022
https://www.pararius.com/apartment-for-rent/amsterdam/88f109dc/papaverweg,Apartment Papaverweg,1032 KH (Volewijck),1275,47,2,Upholstered,"A modern apartment in Amsterdam Noord, within 3 minutes from Central Station by pound or bicycle. The highway is also nearby. The apartment has laminate flooring and CV. There is a bicycle shed and outside space for general use. A caretaker is situated in the building 24/7. If you rent for 2 persons 50 euros will be added to the rent.",2 months,Not available to book,Specifics are not available,Upkeep is not available,Volume is not available,Apartment,Existing building,Constructed year is not available,Location type is not available,1,Number of bathrooms is not available,Number of floors is not available,Not present,Not present,Details of storage is not available,Details of description of the storage is not available,No,https://www.pararius.com/contact/88f109dc/amsterdam/a-n-vastgoed-den-haag/request-details,22-08-2022
https://www.pararius.com/apartment-for-rent/amsterdam/686bfc84/linnaeusstraat,Apartment Linnaeusstraat,1093 ED (Dapperbuurt),2300,63,2,Interior is not available,"We offer a luxury apartment on the first floor with original details, high ceilings and a high standard of finishing across from the monumental Tropenmuseum!",2 months,consultation,Specifics are not available,Good,199,Apartment,Existing building,1882,Location type is not available,1,1,1,Not present,Not present,Details of storage is not available,Details of description of the storage is not available,Yes,https://www.pararius.com/contact/686bfc84/amsterdam/boomsma-bruinsma-makelaars/request-details,22-08-2022
https://www.pararius.com/apartment-for-rent/amsterdam/791fac09/van-breestraat,Apartment Van Breestraat 90 II,1071 ZS (Museumkwartier),4500,122,7,Upholstered,"We offer a lovely family home available in one of the nicest streets of Amsterdam Old-South, the Van Breestraat.",2 months,Not available to book,Specifics are not available,Good,345,Apartment,Existing building,Before 1906,Location type is not available,4,2,3,Present,Not present,Details of storage is not available,Details of description of the storage is not available,Yes,https://www.pararius.com/contact/791fac09/amsterdam/dutch-housing-centre-bv/request-details,22-08-2022
https://www.pararius.com/apartment-for-rent/amsterdam/6c424ce9/esplanade-de-meer,Apartment Esplanade de Meer,1098 WN (Middenmeer),2500,96,3,Furnished,Lovely furnished apartment for rent in Amsterdam with 2 bedrooms in the Middenmeer district.,2 months,consultation,Specifics are not available,Good,268,Apartment,Existing building,2002,in a residential area,2,Number of bathrooms is not available,1,Details of balcony is not available,Not present,Not present,Details of description of the storage is not available,Yes,https://www.pararius.com/contact/6c424ce9/amsterdam/the-dutch-realty/request-details,22-08-2022
https://www.pararius.com/apartment-for-rent/amsterdam/d5d8f0eb/raamgracht,Apartment Raamgracht,1011 KH (Nieuwmarkt/Lastage),1700,90,2,Furnished,Beautiful Fully furnished apartment on the Raamgracht in Amsterdam.   ,2 months,Not available to book,Specifics are not available,Upkeep is not available,Volume is not available,Apartment,Existing building,Constructed year is not available,Location type is not available,1,1,Number of floors is not available,Not present,Not present,Not present,Details of description of the storage is not available,No,https://www.pararius.com/contact/d5d8f0eb/amsterdam/michiel-stolker-real-estate/request-details,22-08-2022
https://www.pararius.com/apartment-for-rent/amsterdam/1cb34bf2/ndsm-kade,Apartment NDSM-kade,1033 PG (Noordelijke IJ-oevers West),1694,89,2,Upholstered,"Delivery end of 2022, viewings only available from then on  ",2 months,01-12-2022,Specifics are not available,Upkeep is not available,Volume is not available,Apartment,New development,2022,Location type is not available,1,1,Number of floors is not available,Present,Not present,Not present,Details of description of the storage is not available,No,https://www.pararius.com/contact/1cb34bf2/amsterdam/fris-woningmakelaars-amsterdam/request-details,22-08-2022
https://www.pararius.com/apartment-for-rent/amsterdam/83aa1b10/ndsm-kade,Apartment NDSM-kade,1033 PG (Noordelijke IJ-oevers West),1568,64,2,Upholstered,"Delivery end of 2022, viewings only available from then on  ",2 months,01-12-2022,Specifics are not available,Upkeep is not available,Volume is not available,Apartment,New development,2022,Location type is not available,1,1,Number of floors is not available,Present,Not present,Not present,Details of description of the storage is not available,No,https://www.pararius.com/contact/83aa1b10/amsterdam/fris-woningmakelaars-amsterdam/request-details,22-08-2022
https://www.pararius.com/apartment-for-rent/amsterdam/b10dbe3c/ndsm-kade,Apartment NDSM-kade,1033 PG (Noordelijke IJ-oevers West),1265,63,2,Upholstered,"Delivery end of 2022, viewings only available from then on  ",2 months,01-12-2022,Specifics are not available,Upkeep is not available,Volume is not available,Apartment,New development,2022,Location type is not available,1,1,Number of floors is not available,Present,Not present,Present,Details of description of the storage is not available,No,https://www.pararius.com/contact/b10dbe3c/amsterdam/fris-woningmakelaars-amsterdam/request-details,22-08-2022
https://www.pararius.com/apartment-for-rent/amsterdam/c4c0fce4/ndsm-kade,Apartment NDSM-kade,1033 PG (Noordelijke IJ-oevers West),1487,71,2,Upholstered,"Delivery end of 2022, viewings only available from then on  ",2 months,01-12-2022,Specifics are not available,Upkeep is not available,Volume is not available,Apartment,New development,2022,Location type is not available,1,1,Number of floors is not available,Present,Not present,Present,Details of description of the storage is not available,No,https://www.pararius.com/contact/c4c0fce4/amsterdam/fris-woningmakelaars-amsterdam/request-details,22-08-2022
https://www.pararius.com/apartment-for-rent/amsterdam/128d59ac/boeninlaan,Apartment Boeninlaan,"1102 TP (Bijlmer Centrum (D,F,H))",1900,80,4,Furnished,"Furnished apartment for rent in Amsterdam with 3 bedrooms in the Bijlmer Centrum (D,F,H) district.",3 months,Not available to book,Specifics are not available,Reasonable,200,Apartment,Existing building,1985,in a residential area,3,Number of bathrooms is not available,1,Details of balcony is not available,Not present,Not present,Details of description of the storage is not available,Yes,https://www.pararius.com/contact/128d59ac/amsterdam/dutch-expat-consult/request-details,22-08-2022
https://www.pararius.com/apartment-for-rent/amsterdam/dc3b5e25/plantage-middenlaan,Apartment Plantage Middenlaan,1018 DE (Weesperbuurt/Plantage),3250,147,4,Upholstered,Paradise living in the city at a high level!,3 months,Not available to book,Specifics are not available,Good,490,Apartment,Existing building,Before 1906,Location type is not available,2,2,2,Not present,"Present (12 m², located on the south)",Present,Inpandig,Yes,https://www.pararius.com/contact/dc3b5e25/amsterdam/keij-stefels-makelaars-en-taxateurs/request-details,22-08-2022
https://www.pararius.com/apartment-for-rent/amsterdam/c47d6bed/grasweg,Apartment Grasweg 168,1031 HX (Noordelijke IJ-oevers West),1550,62,3,Interior is not available,*,3 months,consultation,Specifics are not available,Excellent,186,Apartment,New development,2021-2030,By the water,2,Number of bathrooms is not available,1,Present,Not present,Details of storage is not available,Parkeerplaats te huur,Yes,https://www.pararius.com/contact/c47d6bed/amsterdam/uppmark/request-details,22-08-2022
https://www.pararius.com/apartment-for-rent/amsterdam/53e8856f/mary-van-der-sluisstraat,Apartment Mary van der Sluisstraat 284 *,1095 ME (Zeeburgereiland/Nieuwe Diep),2750,88,3,Interior is not available,AVAILABLE AS OF AUGUST 29TH - LUXURIOUS FULLY FURNISHED 100M2 TWO-BEDROOM APARTMENT WITHIN A SECURED APARTMENT COMPLEX IN AMSTERDAM EAST,3 months,29-08-2022,Specifics are not available,Excellent,229,Apartment,New development,2017,Location type is not available,2,1,2,Not present,Present,Present,Details of description of the storage is not available,Details of garage is not available,https://www.pararius.com/contact/53e8856f/amsterdam/mid-stay-apartments/request-details,22-08-2022
https://www.pararius.com/apartment-for-rent/amsterdam/ae776142/distelweg,Apartment Distelweg 243,1031 HD (Noordelijke IJ-oevers West),1683,64,3,Interior is not available,Beautiful apartment for rent in Amsterdam with 2 bedrooms in the Noordelijke IJ-oevers West district.,3 months,Not available to book,Specifics are not available,Excellent,166,Apartment,New development,2022,Location type is not available,2,Number of bathrooms is not available,1,Details of balcony is not available,Not present,Details of storage is not available,Details of description of the storage is not available,No,https://www.pararius.com/contact/ae776142/amsterdam/van-der-linden-vastgoedmanagement-amsterdam-2/request-details,22-08-2022
https://www.pararius.com/apartment-for-rent/amsterdam/51c6523b/distelweg,Apartment Distelweg 237,1031 HD (Noordelijke IJ-oevers West),1672,69,3,Interior is not available,Beautiful apartment for rent in Amsterdam with 2 bedrooms in the Noordelijke IJ-oevers West district.,3 months,Not available to book,Specifics are not available,Excellent,180,Apartment,New development,2022,Location type is not available,2,Number of bathrooms is not available,1,Details of balcony is not available,Not present,Details of storage is not available,Details of description of the storage is not available,No,https://www.pararius.com/contact/51c6523b/amsterdam/van-der-linden-vastgoedmanagement-amsterdam-2/request-details,22-08-2022
https://www.pararius.com/apartment-for-rent/amsterdam/28d6ff64/houthavenweg,Apartment Houthavenweg,1014 ZA (Houthavens),1688,60,1,Interior is not available,Apartment for rent in Amsterdam in the Houthavens district.,3 months,Not available to book,Specifics are not available,Excellent,156,Apartment,New development,2022,Location type is not available,Number of bedrooms is not available,Number of bathrooms is not available,1,Details of balcony is not available,Not present,Details of storage is not available,Details of description of the storage is not available,No,https://www.pararius.com/contact/28d6ff64/amsterdam/wooove-b-v/request-details,22-08-2022
https://www.pararius.com/apartment-for-rent/amsterdam/41f964c4/haparandaweg,Apartment Haparandaweg,1013 BD (Houthavens),1328,43,1,Interior is not available,Nice apartment for rent in Amsterdam in the Houthavens district.,3 months,Not available to book,Specifics are not available,Excellent,109,Apartment,New development,2022,Location type is not available,Number of bedrooms is not available,Number of bathrooms is not available,1,Details of balcony is not available,Not present,Details of storage is not available,Details of description of the storage is not available,No,https://www.pararius.com/contact/41f964c4/amsterdam/wooove-b-v/request-details,22-08-2022
https://www.pararius.com/apartment-for-rent/amsterdam/79c969e1/groenburgwal,Apartment Groenburgwal,1011 HX (Nieuwmarkt/Lastage),1900,70,2,Furnished,"The Groenburgwal, one of the most beautiful locations in the old historic center of the city. Center of cloth weaving mills where wool was woven into cloth and then dyed. The Groenburgwal owes its name to the green dye houses that were located here.",3 months,01-10-2022,Specifics are not available,Upkeep is not available,Volume is not available,Apartment,Existing building,Constructed year is not available,Location type is not available,1,1,Number of floors is not available,Details of balcony is not available,Details of garden is not available,Details of storage is not available,Details of description of the storage is not available,No,https://www.pararius.com/contact/79c969e1/amsterdam/123wonen-amsterdam/request-details,22-08-2022
https://www.pararius.com/apartment-for-rent/amsterdam/0e62b8c5/prinsengracht,Apartment Prinsengracht,1016 GX (Grachtengordel-West),3250,92,3,Interior is not available,"Prinsengracht 299-D, 1016 GX Amsterdam",3 months,consultation,Specifics are not available,Good,362,Apartment,Existing building,Before 1906,Location type is not available,2,2,2,Not present,Present (18 m²),Details of storage is not available,Details of description of the storage is not available,Yes,https://www.pararius.com/contact/0e62b8c5/amsterdam/engel-en-volkers-amsterdam-centrum/request-details,22-08-2022
https://www.pararius.com/house-for-rent/amsterdam/30c5b578/keizersgracht,House Keizersgracht 786,1017 EC (Grachtengordel-Zuid),13000,450,12,Upholstered,A stunning nostalgic canal house with enormous appeal.,3 months,Not available to book,Specifics are not available,Excellent,1.26,House,Existing building,1688,Location type is not available,6,4,5,Not present,Present (219 m²),Present,Aangebouwd steen,Yes,https://www.pararius.com/contact/30c5b578/amsterdam/broersma-makelaardij/request-details,22-08-2022
https://www.pararius.com/apartment-for-rent/amsterdam/6b270542/minervalaan,Apartment Minervalaan 84 I,1077 PK (Apollobuurt),4250,140,4,Upholstered,Unfurnished!,3+ months,consultation,Specifics are not available,Upkeep is not available,Volume is not available,Apartment,Existing building,Constructed year is not available,Location type is not available,2,2,Number of floors is not available,Present,Not present,Details of storage is not available,Details of description of the storage is not available,Yes,https://www.pararius.com/contact/6b270542/amsterdam/hakkenbroek-housing-company/request-details,22-08-2022
